{
    "schemaVersion":  1,
    "graphRunId":  "mgr-cron-20260724-align-august-production",
    "graphRevision":  7,
    "workflowId":  "marketing-chief-execution-graph",
    "createdAt":  "2026-07-24T12:06:43.9694177+00:00",
    "updatedAt":  "2026-07-24T13:49:33.4882983+00:00",
    "status":  "handoff_ready",
    "queueSnapshot":  {
                          "locator":  "queue/work-items.json",
                          "revision":  177,
                          "sha256":  "2264D5C56C4C8F721A9C78ADF35E1FD81FBE1A1D8CF80E9FBCB660C2FC71E0F5",
                          "capturedAt":  "2026-07-24T12:06:43.9694177+00:00"
                      },
    "workItem":  {
                     "id":  "wi-20260723-0004",
                     "expectedVersion":  1,
                     "contentSha256":  "AE26C7F289364ABC5CF0060BBD76843FF7627FD1BBEEF125BF55EDF7D5C6F4A5",
                     "clientId":  "align-hcm",
                     "title":  "Finish Align August 2026 production package",
                     "status":  "ready",
                     "lane":  "normal",
                     "priority":  "P1",
                     "actionClass":  "local_artifact",
                     "nextAction":  "Using the verified Align repository, render and inspect AN01 through AN06 as final MP4s, create the Beumer and Troon static assets, cut the two remaining Maher and Brent podcast recuts, and assemble QA evidence. Preserve Joann and Moe as recording dependent gates. Keep every output local for owner review.",
                     "definitionOfDone":  [
                                              "Complete the requested local outcome and record allowlisted evidence.",
                                              "Preserve the exact active client route and exclude raw communications, direct identifiers, and secrets.",
                                              "Keep external delivery, publishing, spend, account changes, and destructive actions pending explicit approval."
                                          ],
                     "sourceLocator":  "sites-intent:d9a9879c-8c64-4166-9bf3-b6ec4169e452",
                     "evidenceRefs":  [
                                          "sites-intent:d9a9879c-8c64-4166-9bf3-b6ec4169e452"
                                      ],
                     "artifactRefs":  [

                                      ],
                     "dependencies":  [

                                      ],
                     "approval":  {
                                      "tier":  "automatic",
                                      "status":  "not_required",
                                      "gate":  "none"
                                  }
                 },
    "scope":  {
                  "canonicalProject":  "C:\\Users\\dillo\\Documents\\Codex\\projects\\client-operations",
                  "clientRoot":  "clients/align-hcm",
                  "graphLocator":  "state/execution-graphs/wi-20260723-0004/mgr-cron-20260724-align-august-production/execution-graph.json",
                  "canonicalWriteAllowed":  false,
                  "externalActionAllowed":  false,
                  "durableMemoryWriteAllowed":  false,
                  "privacy":  "redacted"
              },
    "retrieval":  {
                      "strategy":  "exact-plus-graph",
                      "exactBindingRequired":  true,
                      "semanticBindingAllowed":  false,
                      "sourceCount":  1,
                      "artifactCount":  0
                  },
    "nodes":  [
                  {
                      "id":  "scope-guard",
                      "kind":  "scope_guard",
                      "owner":  "graph-generator",
                      "status":  "completed",
                      "task":  "Validate immutable queue, work-item, client, and project scope.",
                      "requires":  [

                                   ],
                      "produces":  [
                                       "scoped_work_item"
                                   ],
                      "attempts":  0,
                      "maxAttempts":  3,
                      "approvalGate":  "none",
                      "output":  {
                                     "summary":  "Queue revision, work-item version, exact client route, and safety scope were validated.",
                                     "artifacts":  [

                                                   ],
                                     "evidence":  [
                                                      "queue/work-items.json",
                                                      "sites-intent:d9a9879c-8c64-4166-9bf3-b6ec4169e452"
                                                  ],
                                     "verification":  [
                                                          "Queue revision 177 captured.",
                                                          "Work-item version 1 captured.",
                                                          "Client route align-hcm resolved exactly once and is active."
                                                      ]
                                 }
                  },
                  {
                      "id":  "source-intake",
                      "kind":  "source_intake",
                      "owner":  "graph-generator",
                      "status":  "completed",
                      "task":  "Capture safe exact source and evidence locators.",
                      "requires":  [
                                       "scope-guard"
                                   ],
                      "produces":  [
                                       "provenance_slice"
                                   ],
                      "attempts":  0,
                      "maxAttempts":  3,
                      "approvalGate":  "none",
                      "output":  {
                                     "summary":  "Exact source and evidence locators were captured without raw communications.",
                                     "artifacts":  [

                                                   ],
                                     "evidence":  [
                                                      "sites-intent:d9a9879c-8c64-4166-9bf3-b6ec4169e452"
                                                  ],
                                     "verification":  [
                                                          "Evidence freshness evaluated at 2026-07-24T12:06:43.9694177+00:00."
                                                      ]
                                 }
                  },
                  {
                      "id":  "context-retrieval",
                      "kind":  "context_retrieval",
                      "owner":  "marketing-chief-context-loader",
                      "status":  "completed",
                      "task":  "Assemble the exact bounded context slice required by this item.",
                      "requires":  [
                                       "source-intake"
                                   ],
                      "produces":  [
                                       "worker_context"
                                   ],
                      "attempts":  0,
                      "maxAttempts":  3,
                      "approvalGate":  "none",
                      "output":  {
                                     "summary":  "Bounded client, source, artifact, dependency, and definition-of-done context was assembled.",
                                     "artifacts":  [

                                                   ],
                                     "evidence":  [
                                                      "sites-intent:d9a9879c-8c64-4166-9bf3-b6ec4169e452"
                                                  ],
                                     "verification":  [
                                                          "Definition-of-done checks: 3.",
                                                          "Artifact references: 0."
                                                      ]
                                 }
                  },
                  {
                      "id":  "worker-execution",
                      "kind":  "worker_execution",
                      "owner":  "bounded-worker",
                      "status":  "completed",
                      "task":  "Using the verified Align repository, render and inspect AN01 through AN06 as final MP4s, create the Beumer and Troon static assets, cut the two remaining Maher and Brent podcast recuts, and assemble QA evidence. Preserve Joann and Moe as recording dependent gates. Keep every output local for owner review.",
                      "requires":  [
                                       "context-retrieval"
                                   ],
                      "produces":  [
                                       "local_artifacts",
                                       "worker_evidence"
                                   ],
                      "attempts":  1,
                      "maxAttempts":  3,
                      "approvalGate":  "none",
                      "output":  {
                                     "summary":  "Completed the local Align August production package: AN01 through AN06 masters, Beumer and Troon statics, and two Maher and Brent podcast recuts are present with reproducible sources and QA evidence; Joann and Moe remain recording dependent gates.",
                                     "artifacts":  [
                                                       "clients/align-hcm/worktrees/align-hcm-vib-design-import-20260722/deliverables/align-implementation-starts-before-kickoff-30s/master-1080x1350.mp4",